{
  "run_id": "MINIMAL_0001",
  "timestamp_utc": "2025-12-10T16:22:36Z",
  "machine": {
    "platform": "demo"
  },
  "code": {
    "source_hash": "demo",
    "dirty_flag": true
  },
  "locks": {
    "canon_lock_sha256": "88d541b6af706ae2b2d978cc19fc75c2246e535c29b19963dc50cde182ae61ac",
    "realization_lock_sha256": "943a8d981f8d75d6e7d731d735fadfba55c659c1b1b825749dedc5021e5cf640",
    "analysis_lock_sha256": "b0e9cf6478df1f89ebd3561ba4b2fb65f4aa8bb01b1d80be814364650c65d3b1",
    "sim_lock_sha256": "f64474d63dc98d5f5054fce7e6a825cb4415208a659c268dd4c3f26701b322ce",
    "lock_chain_sha256": "923649993f0ed24e06525152e85b0a4a77d995159bfd8f1ec2c4c0495c1a22e4"
  },
  "sim": {
    "resolution": {
      "Nx": 10,
      "Ny": 10,
      "Nz": 1
    },
    "boundary_condition": "periodic",
    "dt_tick": 1.86e-21,
    "warmup_ticks": 0,
    "total_ticks": 5376344086021505376340,
    "update_rule_id": "demo_event_generator_v1"
  },
  "outputs": {
    "event_log_path": "event_log.jsonl",
    "signal_log_path": "signal_log.jsonl",
    "summary_path": "summary.json",
    "run_checksums_path": "checksums.json"
  }
}